### ISSUE TITLE
Design clarification: expected TLS trust policy for native WebSocket clients

### ISSUE THREAD

**Issue by tucktuck101** [launchpad-26/buzz#108]
Desktop app connects to a relay over the HTTP bridge but its live WebSocket never authenticates, so the app can **read but not write**. Found while executing SOP Step 12 against a VM-hosted relay on 2026-08-12.

## Symptom the user sees

Sidebar card: **"Can't reach the relay — click to connect"**. Channels, profiles and history all load normally, so the app looks connected apart from that card. Sending a message appears to do nothing and reports no error.

The message is misleading: the relay is reached, and is being read from continuously.

## What is actually happening

Three distinct behaviours, all reproducible:

**1. On boot the socket opens and is never authenticated**

```
01:35:55  WebSocket connection established
01:36:00  NIP-42 auth timeout — closing connection   (timeout_secs: 5)
01:36:00  WebSocket connection closed
```

The socket connects; the app never sends its NIP-42 AUTH event; the relay closes it after 5 seconds.

**2. The reconnect button produces no connection attempt at all**

Clicking the card (`SidebarRelayConnectionCard.tsx`, `onAction={onReconnect}`) results in **nothing** at the relay — no `WebSocket connection established`, no TLS handshake — and nothing in the app's stdout. Verified by watching relay logs live across several clicks, including one that took time to complete.

**3. Message sends never leave the app**

Posting into a channel produces no event at the relay (`select count(*) from events where kind in (9,40002)` stays at 0), no error at the relay, and no output in the app. Reads continue working throughout.

## What is NOT the cause

Each of these was checked and eliminated:

| Hypothesis | Evidence against |
|---|---|
| TLS / self-signed CA rejected | `curl --http1.1` to the same URL returns **101**, with `ssl_verify_result=0` (no `-k`). The Caddy root is trusted in the System keychain, and the build includes `rustls-platform-verifier` |
| Wrong relay URL | Stored community is `wss://buzz-vm.test:8443`; the boot-time socket **did** arrive at that relay |
| Wrong / missing identity | `configured identity pubkey` matches `RELAY_OWNER_PUBKEY`; every HTTP bridge request is NIP-98-signed and accepted as owner |
| Not a relay member | Owner is auto-approved at community seeding; no `relay_membership_required` on the boot connection |
| Stale local state | Reproduced after clearing the webview store and killing all surviving processes |

The app demonstrably **can** sign with the right key — it does so on every REST call. It simply never signs the WS AUTH.

## Environment

- Relay behind Caddy with `tls internal`, reachable at `wss://buzz-vm.test:8443`
- `tauri dev`, `--features system-keyring`, rustc 1.95.0, macOS Intel
- `BUZZ_PRIVATE_KEY`, `BUZZ_SHARE_IDENTITY=1`, `BUZZ_RELAY_URL`, `BUZZ_DEV_KEYRING_SERVICE` all set

## Impact

Blocks SOP Step 12 / checklist item 18 — a message cannot be posted, so the deployment cannot be verified end to end from the desktop client. Reads working while writes silently fail is also a poor failure mode in its own right: nothing tells the user their message was not sent.

## Suggested starting points

- Why is AUTH not sent after `WebSocket connection established`? Is the signer awaiting a keyring lookup that returns nothing (`has no key in JSON or keyring` appears repeatedly for unrelated agent records)?
- Is `onReconnect` wired to an actual dial? It produces no observable network activity.
- Should a failed send surface an error rather than failing silently?

**Comment by tucktuck101** [comment]
## Root cause identified — the app runs TWO identities simultaneously

The original report described the socket connecting and never sending AUTH. After clearing local state the behaviour changed, and the change is the diagnosis: the app now **does** send AUTH — with a **different key from the one it reports as its identity**.

### Observed

| Path | Identity used |
|---|---|
| Profile display, `.env` owner, every NIP-98 HTTP bridge call | `2cf82270a262e4b872f0ceac222e763bf96c55f6a0ff9cee7f585eea1bccab2b` (`npub19nuzy…pcj5`) — from `BUZZ_PRIVATE_KEY` |
| WebSocket NIP-42 AUTH | `b2a3b3af8082832d3fb8752637ae7907575959c1923fb6f7a9d8b7d67709a45b` (`npub1k23m8t…z7pq4`) |

```
02:11:35  WebSocket connection established
02:11:35  not a relay member  pubkey=b2a3b3af…  403 relay_membership_required
02:11:36  WebSocket connection closed
```

`b2a3b3af…` is a **fourth** identity on this machine — not the owner, not the pre-existing local-stack identity, and not any of the three managed-agent pubkeys. It **did not exist before the webview store was cleared**. The app generated it.

### Why this also explains the original symptom

The two reported behaviours are the same defect at different stages:

- **Before clearing:** the WS key-resolution path found an empty isolated keyring, had no key, and therefore never sent AUTH → `NIP-42 auth timeout` after 5s
- **After clearing:** the same path generated a fresh key and authenticated with it → `not a relay member`

Either way the WebSocket never uses the identity the rest of the app is using. The UI reports "Can't reach the relay", which is doubly misleading — the relay is reached, and the real problem is an identity mismatch inside the app.

### Why this is a defect rather than configuration

`desktop/src-tauri/src/secret_store.rs:17` states `BUZZ_PRIVATE_KEY` resolution is *"handled upstream (an env short-circuit for the human key)"*, and explicitly warns that adding a second env tier would "create a divergent-behavior trap". The WebSocket path appears not to consult that short-circuit, which is exactly the divergence the comment warns against: two resolution paths for one human identity, disagreeing.

Consequences visible to a user:

1. The profile says you are the owner while your messages are signed by a different key
2. Sends fail **silently** — no event reaches the relay, no error is surfaced
3. Reads keep working (HTTP bridge), so the app appears healthy

### Reproduction

1. Launch `tauri dev` with `BUZZ_PRIVATE_KEY` set to an identity the relay has rostered
2. Ensure the keyring namespace is empty (e.g. a fresh `BUZZ_DEV_KEYRING_SERVICE`)
3. Observe: profile shows the `BUZZ_PRIVATE_KEY` identity; relay logs show AUTH from a different, generated pubkey

### Workaround

Roster the generated key (`./run.sh add-member <generated pubkey> --role member`). This restores read/write but leaves the client operating as a non-owner, so owner-only actions remain unavailable.

**Comment by tucktuck101** [comment]
## CORRECTION — the "two identities" root cause in the previous comment was WRONG

A controlled re-test invalidates it. Recording the correction and the method, because the way the earlier conclusion went wrong is itself the useful part.

### The confounder

The relay serves a **web client** at `https://buzz-vm.test:8443`. The operator had that page open in Safari — reasonably, because chunk 03's verification step tells you to open it to confirm the CA is trusted.

That web client **generates its own ephemeral identity** and connects over WebSocket. Being unrostered, it is refused:

```
not a relay member  pubkey=b2a3b3af…  403 relay_membership_required
```

Those events were attributed to the desktop app. They were the browser. `b2a3b3af…` was never a desktop-app identity, which is why it appeared in none of its stores — not the keyring, not `managed-agents.json`, not `localStorage`.

### Clean-room re-test

Safari fully quit, every surviving `buzz-desktop` process killed, watcher armed **before** launch, then a fresh app start. Four minutes of relay logs:

| | Count |
|---|---|
| HTTP bridge requests | 13 |
| Distinct pubkeys | **1** — `2cf82270…`, the correct owner |
| WebSocket connections established | **0** |
| `not a relay member` | **0** |
| NIP-42 auth timeouts | **0** |

`b2a3b3af…` did not reappear. It left with the browser.

### The actual defect

**The desktop app never opens a WebSocket at all.**

- Its identity is correct and consistent — every NIP-98 HTTP call is signed by the owner key and accepted
- It has attempted exactly **one** WebSocket in its lifetime (at boot, hours ago), which connected and then never sent AUTH → closed on the 5s timeout
- Since then: zero dial attempts, including after clicking the "Can't reach the relay — click to connect" card
- `get_channels` keeps succeeding, so the UI looks populated — those reads are served from a **local cache**, not the relay

So the user-visible state is: an app that looks connected, is read-only from stale cache, and silently discards sends.

### What this rules IN

The earlier finding that both transports share one key source now looks correct rather than contradictory: `signing_keys()` (`app_state.rs:318`) and `relay.rs:107` both read `state.keys`, and `resolve_persisted_identity` correctly returns early when `identity_from_env()` is `Some` (`app_state.rs:362`). There is **no identity split**. The identity layer is sound.

The defect is in the WebSocket **connection lifecycle** — nothing dials, and the reconnect action produces no attempt.

### Method note worth keeping

Two separate confounders each produced a false conclusion in this session:

1. **A stale app process.** `Ctrl+C` on `tauri dev` leaves `buzz-desktop` running; `tauri_plugin_single_instance` then makes every relaunch exit silently after printing the identity line. Three "relaunches" changed nothing while the window on screen stayed a 20-minute-old process.
2. **The relay's own web client.** An open tab is an unlabelled second client on the same relay, and its traffic is indistinguishable from the app's in relay logs.

Both should be eliminated before trusting any relay-side observation. Suggested addition to the runbook: close the web-client tab and `ps`-check for a surviving `buzz-desktop` before debugging desktop connectivity.

**Comment by tucktuck101** [comment]
## ROOT CAUSE (pending peer validation): the two transports use different TLS trust stores

### The finding

`desktop/src-tauri/Cargo.toml:86`

```toml
tokio-tungstenite = { version = "0.29", features = ["rustls-tls-webpki-roots"] }
```

And from `Cargo.lock`, the only crate depending on `rustls-platform-verifier` is **`reqwest`**.

| Transport | Crate | Trust store | Against a `tls internal` CA |
|---|---|---|---|
| HTTP bridge (reads, NIP-98) | `reqwest` → `rustls-platform-verifier` | macOS System keychain | **trusts it** |
| Live WebSocket | `tokio-tungstenite` → `rustls-tls-webpki-roots` | bundled Mozilla roots, compiled in | **cannot trust it, by construction** |

The relay here sits behind Caddy with `tls internal` — a private CA, explicitly added to the macOS System keychain. `curl` accepts it (`ssl_verify_result=0`, WebSocket upgrade returns `101`). `reqwest` accepts it. `webpki-roots` cannot, because trusting it would require the root to be in the compiled-in Mozilla set, and no amount of keychain trust changes that.

### Why this fits every observation

- HTTP bridge works continuously and is accepted as the owner — different trust store
- The native WebSocket never establishes — private CA rejected before any Nostr protocol runs
- **No error is surfaced**, because the failure is a TLS handshake failure inside a background task, below the layer that reports connection state
- The UI says "Can't reach the relay", which is technically accurate but points at the network rather than at certificate trust
- Reads keep rendering from a local cache, so the app looks healthy while being read-only
- Sends vanish silently, because writes require the socket

### Why it was so hard to see

It is invisible to every check that a normal operator would run: `curl` succeeds, the cert is trusted system-wide, the browser loads the relay's own web client, DNS resolves, the relay accepts WebSocket upgrades, and the app's identity is provably correct. Everything external to the app is right, and the one differing component is a Cargo feature flag.

### Important scope note

**This would not reproduce against production.** A relay with a Let's Encrypt certificate chains to a root that *is* in `webpki-roots`, so the native WebSocket would connect normally. The defect only manifests against a private/self-signed CA — i.e. exactly the `tls internal` configuration used for local and VM development.

That makes it a **dev-environment blocker rather than a production one**, but it blocks the documented Step 12 verification, which is the step that proves a deployment is usable end to end.

### Method note

Found jointly with a second AI agent (Codex) working the same evidence independently. It eliminated the state-machine hypotheses by reading the reconnect controller and policy — proving `terminal`, backoff and `connectPromise` could not explain the click producing nothing — and it located `desktop/src-tauri/src/native_websocket.rs`, which established that the socket is a **native Rust** socket rather than a browser `new WebSocket`. That reframing is what made the Cargo feature flag the obvious next place to look. Earlier hypotheses about WKWebView TLS were wrong precisely because the socket was assumed to be in the webview.

**Comment by tucktuck101** [comment]
## Peer validation (Codex) — trust-store split CONFIRMED, with one correction to my write-up

### Confirmed at the library level

- `tokio-tungstenite` 0.29 with `rustls-tls-webpki-roots` builds an **empty** `RootCertStore` and then extends it with `webpki_roots` only.
- `reqwest` 0.13's default rustls path uses `rustls_platform_verifier::Verifier`, which on macOS goes through **Security.framework / the keychain**.

So the two transports genuinely consult different trust material, and a privately-issued `tls internal` certificate can only ever satisfy the second one.

### Correction to my earlier comment

I wrote that the TLS failure happens "in a background task, below the layer that reports connection state". **That is wrong.**

`native_websocket::open_connection` awaits `connect_async` and returns `Err` **before** spawning `run_connection`. So the error does propagate: the TS `invoke` rejects. The silence is not structural invisibility — it is that **the reconnect paths largely swallow the rejection**.

That is a meaningfully different defect, and a more fixable one: the error exists and is discarded, rather than never existing. It also means a user-facing "certificate not trusted" message is achievable without re-plumbing the connection layer.

### Consequence for the one socket that did open

A socket that genuinely upgraded and then sat until the relay's 5-second NIP-42 timeout **cannot** have been this native client, under unchanged certificate and trust conditions — the native client cannot complete a TLS handshake against this CA at all.

That points at the browser tab on the relay's own web client, which uses the system trust store and therefore *can* handshake. It reinforces the earlier correction: the desktop app has very likely **never** established a WebSocket to this relay.

### Falsification test being run now

Codex's proposed discriminator, which distinguishes two outcomes that would otherwise look identical:

- **Zero upgraded WebSockets and no Caddy access-log entry** — *compatible* with the trust-store hypothesis (the handshake fails before HTTP)
- **Zero TCP/TLS attempts in a packet capture** — would **falsify** it, because a client rejecting a certificate must still have opened a TCP connection and sent a ClientHello first

Running `tcpdump` on the guest for port 443, filtered to SYN packets and TLS handshake records, across a fresh app launch. Result to follow.

**Comment by tucktuck101** [comment]
## Falsification test result: hypothesis SURVIVES — and a third correction

`tcpdump` on the guest, port 443, SYN + TLS-handshake filter, across a fresh app launch:

```
02:53:18.230  IP 10.0.2.2.63864 > 10.0.2.15.443: Flags [S]           <- app dials (two sockets)
02:53:18.230  IP 10.0.2.2.63865 > 10.0.2.15.443: Flags [S]
02:53:18.230  IP 172.18.0.6.443 > 10.0.2.2.63864: Flags [S.]         <- Caddy accepts
02:53:18.312  IP 10.0.2.2.63864 > 10.0.2.15.443: Flags [P.] length 261   <- TLS ClientHello
02:53:18.322  IP 172.18.0.6.443 > 10.0.2.2.63865: Flags [P.] length 93   <- server response
                                                                     <- no session, no relay log entry
```

### What this settles

- **Not falsified.** TCP and TLS attempts exist. Codex's discriminator was: *zero TCP/TLS attempts would falsify the trust-store hypothesis*. We see SYN, SYN-ACK and a 261-byte ClientHello, so the client is dialling and speaking TLS.
- The connection dies **during certificate verification**, after the handshake begins and before any HTTP upgrade. That is why the relay logs zero WebSocket connections while packets flow the entire time.

### Correction — the third in this investigation

An earlier comment stated "the desktop app never opens a WebSocket at all" and that it "never dials". **Wrong.** It dials on every attempt. The accurate statement is:

> Every WebSocket dial reaches TLS and is aborted by the client during certificate verification, so no session is ever established.

The three corrections in sequence, recorded because the pattern is instructive:

1. "Two identities" — wrong; the second identity was a browser tab on the relay's own web client
2. "Never dials" — wrong; it dials every time
3. "Fails in a background task" — wrong (Codex); `open_connection` returns `Err` before spawning, and the reconnect paths swallow it

Each was a plausible reading of partial evidence, and each survived until a test was designed that could kill it. The trust-store hypothesis is the first one that was given a genuine chance to fail and did not.

**Comment by tucktuck101** [comment]
## Five whys — peer-reviewed. Three distinct findings, not one.

Codex challenged my initial chain and restructured it. The key correction: I had collapsed an **occurrence** cause and an **escape** cause into one chain, and buried a third finding entirely.

### Finding 1 — Occurrence root cause: no relay-wide TLS trust policy

1. **Why are live messages unavailable?** The app never establishes its authenticated relay WebSocket. Cached reads stay visible, but live relay operations cannot complete.
2. **Why is no WebSocket established?** The native `wss://` connection fails during TLS negotiation, before the HTTP upgrade. Confirmed by packet capture: SYN, SYN-ACK, a 261-byte ClientHello, then no session.
3. **Why does TLS negotiation fail?** The relay certificate chains to a private CA that macOS trusts but which is absent from the WebSocket client's trust anchors.
4. **Why is that CA absent from only the WebSocket path?** `tokio-tungstenite` is compiled with `rustls-tls-webpki-roots` (an empty `RootCertStore` extended with the compiled-in Mozilla set), while `reqwest` uses `rustls_platform_verifier` (macOS Security.framework).
5. **Why can two transports to the same relay reach different trust decisions?** **Because the application has no explicit relay-wide TLS trust policy. TLS behaviour is inherited independently from dependency features, with no architectural invariant and no parity test.**

That fifth answer is the systemic root cause. It is actionable, and it generalises past this deployment.

### Finding 2 — Escape root cause: the validation matrix omitted the documented trust topology

1. **Why wasn't the incompatibility detected before deployment?** Validation used plaintext `ws://`, which exercises no TLS verifier at all.
2. **Why didn't later TLS validation expose it?** Public-CA testing is trusted by *both* root stores and cannot reveal trust-policy divergence.
3. **Why wasn't a system-trusted private CA tested?** The validation matrix did not include the documented production trust topology.
4. **Why did the matrix omit it?** It implicitly assumed installing a CA into macOS trust would affect **every** application transport.
5. **Why was that assumption never challenged?** The native WebSocket dependency's trust-store choice was neither documented nor tested against the HTTP transport's trust behaviour.

### Finding 3 — Impact amplifier: send failures are neither visible nor durable

Publish cannot obtain a live transport → the resulting failure is not presented durably → there is no visible failed/outbox state → **the user experiences silent loss**.

This is why the session cost hours rather than minutes. A visible *"certificate not trusted"* would have ended it immediately.

### Correction to my own framing

I wrote that a private `tls internal` CA is "the only configuration that separates the two trust stores". **Too narrow.** *Any* CA trusted by the OS but absent from the Mozilla set produces the split — enterprise TLS-interception proxies, corporate PKI, user-installed roots, other internal CAs.

That widens the blast radius considerably: this is not only a local-dev artifact. **Any user behind corporate TLS interception would hit the same failure against a production relay**, with the same silent symptom.

### Outstanding evidence

`UnknownIssuer` is strongly supported but not yet directly proven. The remaining confirmation is either the rejected `connect_async` error, or a decoded TLS alert (expecting `unknown_ca`, alert 48) from the client. A capture filtered to TLS alert records is running.

**Comment by tucktuck101** [comment]
## Root cause PROVEN — no code change required

The remaining gap was direct evidence of `UnknownIssuer`. Closed with `openssl s_client`, which lets us test the same certificate against each trust store independently.

**Against the Mozilla bundle** — the trust material `tokio-tungstenite`'s `rustls-tls-webpki-roots` compiles in:

```
$ openssl s_client -connect buzz-vm.test:8443 -servername buzz-vm.test -CAfile <certifi cacert.pem>
verify error:num=20:unable to get local issuer certificate
Verify return code: 20 (unable to get local issuer certificate)
```

**Against the macOS system trust** — what `reqwest`/`curl` use:

```
$ curl https://buzz-vm.test:8443/
200, ssl_verify_result=0
```

Same certificate. Same host. Same moment. **Opposite verification outcomes.**

The syllogism is complete:

1. The WebSocket client trusts only the compiled-in Mozilla set (verified at library level: `rustls-tls-webpki-roots` builds an empty `RootCertStore` extended with `webpki_roots`)
2. This certificate does not verify against the Mozilla set (proven above)
3. Therefore the WebSocket client cannot verify this certificate, and every `wss://` dial must fail during verification

Which is precisely what the packet capture shows: TCP established, ClientHello sent, no session formed, nothing reaching the relay's HTTP layer.

### Note on the missing TLS alert

The alert capture returned **0 packets**. That is consistent rather than contradictory: rustls fails verification locally and closes the connection, and is not obliged to emit an `unknown_ca` alert first. Absence of an alert is therefore not evidence against the diagnosis — worth recording so nobody re-runs that capture expecting one.

### Status

Occurrence root cause is now **proven**, not inferred. Enhancements to prevent recurrence are being raised separately against the parent PRD.

**Comment by tucktuck101** [comment]
## Reframing: this is a design question, not a defect report

Earlier comments on this issue (kept above — the investigation trail is useful, including the parts that were wrong) framed the finding as a defect in upstream application code and proposed a dependency change. That framing was premature, and this comment supersedes it.

We are a downstream fork. Before calling anything incorrect we needed to establish what behaviour was *intended*, and we did not — there is no ADR, code comment, or document in the repo that states an expected TLS trust contract for the desktop client. Absent that, all we can honestly report is what we measured, plus a question.

The issue has been retitled accordingly: **Design clarification: expected TLS trust policy for native WebSocket clients**.

---

### Verified fact — the two transports use different trust mechanisms

This is directly observable in the manifest and lockfile, not inferred:

| Transport | Crate | Trust anchors |
|---|---|---|
| HTTP bridge | `reqwest` 0.13 | `rustls-platform-verifier` 0.7.0 — delegates to the platform verifier (macOS Security.framework / keychain) |
| Native WebSocket | `tokio-tungstenite` 0.29 | `webpki-roots` — the compiled-in Mozilla root set |

The WebSocket anchor set comes from the feature selection at `desktop/src-tauri/Cargo.toml:86`:

```toml
tokio-tungstenite = { version = "0.29", features = ["rustls-tls-webpki-roots"] }
```

and `webpki-roots` is correspondingly present in `desktop/src-tauri/Cargo.lock` (0.26.11 and 1.0.8), alongside `rustls-platform-verifier` 0.7.0 for the `reqwest` path.

Nothing in the repo requires these two anchor sets to agree, and for public CAs they do agree — so the divergence is invisible in the common case.

### Verified reproduction — an OS-trusted private CA succeeds over HTTP and fails over the native WebSocket

Environment: relay fronted by Caddy with `tls internal` at `wss://buzz-vm.test:8443`; the Caddy root installed and trusted in the macOS **System** keychain; `tauri dev`, macOS Intel, rustc 1.95.0.

1. **Trust-store proof with `openssl s_client`**, same certificate, same moment:
   - against the Mozilla bundle: `verify error:num=20` (unable to get local issuer certificate)
   - against system trust: `ssl_verify_result=0`
2. **HTTP transport succeeds**: `curl --http1.1` against the same URL returns `101` with `ssl_verify_result=0` and no `-k`. Every NIP-98-signed bridge request is accepted.
3. **Native WebSocket does not complete a session**: packet capture shows the ClientHello being sent and no session forming — the dial aborts during certificate verification. The relay logs no established connection for those attempts.

So: one certificate, one machine, one trust decision from the OS — accepted by one transport and not the other. That part we are confident in.

### Scope — this was observed in a topology we chose, not one the project documents

The topology is Caddy with `tls internal`, i.e. a private CA installed into OS trust. That is **our** deviation, adopted for internal parity with how we expect to run things. The project's own documented development path is plaintext `ws://relay:3000`, which never exercises a TLS verifier at all. We do not claim the project intends to support the topology we built, and we would not have encountered this on the documented path.

### Unknown — whether private or internal PKI is meant to be supported

We could not find any statement of intent: no ADR, no comment at the dependency declaration, no documentation of a trust contract. It is entirely possible that Mozilla-only roots for the WebSocket transport are a deliberate, defensible choice (a fixed, auditable anchor set that does not inherit machine-local or interception roots), and that private-PKI relays are simply out of scope.

One observation that may be relevant to the intent question, offered as context rather than as an argument: the `webpki-roots` feature appears to have entered with a huddle-audio feature rather than as a relay-transport trust decision — it arrived in a commit titled *"Replace LiveKit with WebSocket Opus audio relay"*, and the relay socket inherited the shared dependency's feature selection. That is a reading of history, not a claim about anyone's reasoning.

### Question for maintainers

Which of these is the intended policy for native WebSocket connections in the desktop app?

1. **Follow platform trust** — align the WebSocket with the HTTP transport so a single OS-level trust decision governs every connection to a relay
2. **Retain Mozilla-only roots deliberately** — a fixed anchor set for the socket, with private/internal PKI explicitly unsupported
3. **Something else already intended or documented** that we have missed

Whichever it is, we would find it valuable to have it stated somewhere in the repo (ADR or a comment at the dependency), because today the behaviour is only discoverable by reading feature flags across two dependency trees.

### Blast radius, if the policy were ever changed

Worth stating plainly, because our earlier framing understated it. `tokio_tungstenite` is used by **four** components in the desktop crate, not one — any change to its TLS feature selection affects all of them:

- `desktop/src-tauri/src/native_websocket.rs` — the relay socket
- `desktop/src-tauri/src/huddle/relay_api.rs` — huddle audio
- `desktop/src-tauri/src/huddle/playout.rs` — huddle audio playout
- `desktop/src-tauri/src/commands/pairing.rs` — NIP-AB device pairing

A one-line feature change is therefore not a one-component change.

### No asserted production impact

Earlier framing suggested users behind corporate TLS interception would hit this against a production relay. **We never tested that, and it should not be read as an observed failure.** It is an unverified inference from the trust-store mechanics, and we are withdrawing it as a claim. The only failure we have observed is in our own private-CA topology described above.

### Status of our local change

We applied a one-line feature change locally, observed a WebSocket connect and stay open, and then **reverted it in full**. There is no code delta associated with this issue — nothing is being proposed for merge here. The dependent proposals have been re-scoped to match: #111 is now a proposal contingent on the answer to the question above, #112 is scoped to our own verification suite, and #113 is marked cohort-specific.

**Comment by tucktuck101** [comment]
failed deployment and wasted tokens due to lack of clarity on what is hardcoded vs what is not in the deployment path.

Archived and linked by https://github.com/launchpad-26/buzz/pull/82
